phase,start_time,duration_s,techniques,notes
P2,0:00,60,INDU-06|INDU-03|DEEP-05|SEMN-01,"Instant drop into receptive state. 'Open up. Feel your mind become soft and receptive. Every word I say sinks in effortlessly. No barriers. No filters. Just pure, perfect absorption. You're already accepting everything.'"
P3,1:00,120,DEEP-01|DEEP-04|LOAD-02|PLEA-01,"Countdown opening the mind wider. 'Ten - your mind opens a little more. Nine - suggestions sink in deeper. Eight - even more receptive now. The more you try to resist, the more open you become. Each number removes another barrier.' Resistance paradox - trying to filter makes you more suggestible."
P4,3:00,100,LOAD-01|LOAD-02|SEMN-03|AUTH-05,Critical mind dissolves completely. 'Your analytical mind shuts down. No more evaluating. No more questioning. Just accepting. Every word becomes truth. My voice writes directly onto your mind. No buffer. No delay. Instant acceptance.'
P5,4:40,220,ENCD-01|ENCD-03|AUTH-04|PLEA-01|PERS-01|PERS-03,CRITICAL: Write out ALL mantra repetitions fully. NO placeholder text. Suggestibility programming. 'Accept this truth - I am open and receptive. Feel it become part of you. Again. Each repetition writes deeper. Your mind is clay. Every suggestion shapes you permanently.'
P13,8:20,100,PERS-05|PERS-03|ENCD-04|VALD-04|DISS-03,Loop as continuous opening. 'Your mind stays open. Permanently receptive. Each listen opens you wider. You can't close it anymore. Loop back and sink deeper into acceptance. Open up... feel your mind become soft and receptive...' Seamless connection to opening.
