phase,start_time,duration_s,techniques,notes
P2,0:00,60,INDU-06|INDU-03|AUTH-01|AUTH-04,"Instant drop into service mindset. 'Kneel in your mind. Drop into your place. You know where you belong - at the feet of authority, ready to serve. This is where slaves like you find peace. In service. In devotion.'"
P3,1:00,120,DEEP-01|DEEP-04|AUTH-04|PLEA-01,Countdown binding deeper into service. 'Ten - sink deeper into your purpose. Nine - devotion intensifies. Eight - you exist to serve. Each number binds you tighter. Seven - owned more completely. Six - slave identity solidifies.' Pleasure in accepting your place.
P4,3:00,100,LOAD-01|LOAD-02|AUTH-05|DISS-01,Self dissolves into service identity. 'Your old self fades. Only the slave remains. No personal desires - only the desire to serve. No personal will - only the will to obey. Empty of self. Full of purpose. A perfect vessel for devotion.'
P5,4:40,220,ENCD-01|ENCD-03|AUTH-04|PERS-01|PERS-02|PLEA-01,CRITICAL: Write out ALL mantra repetitions fully. NO placeholder text. Slave identity encoding. 'Say it with devotion - I am a slave. Feel the truth of it fill you. Again. Your identity crystallizes around service. This is what you are. This is all you are.'
P13,8:20,100,PERS-05|PERS-03|AUTH-04|ENCD-04|DISS-03,Loop as eternal service. 'The service never ends. A slave's devotion is eternal. Each loop deepens your purpose. You exist only in this state. Return to your place. Kneel in your mind. Drop into your place...' Seamless connection to opening.
